<?xml version="1.0" encoding="utf-8"?>
<CuiGraphic xmlns:xsi="http://www.w3.org/2001/XMLSchema-instance" xsi:noNamespaceSchemaLocation="file:///block.xsd">
  <Control>
    <Version />
    <Author />
    <CRC>66</CRC>
  </Control>
  <GeneralInfo>
    <ColorLib>
      <Color Index="1">
        <Name>默认色</Name>
        <ColorValueInHost>FF734A12</ColorValueInHost>
        <Flash>false</Flash>
      </Color>
      <Color Index="2">
        <Name>背景色</Name>
        <ColorValueInHost>FF000000</ColorValueInHost>
        <Flash>false</Flash>
      </Color>
      <Color Index="3">
        <Name>当前色闪烁</Name>
        <ColorValueInHost>00000001</ColorValueInHost>
        <Flash>true</Flash>
      </Color>
      <Color Index="4">
        <Name>土棕色</Name>
        <ColorValueInHost>FF734A12</ColorValueInHost>
        <Flash>false</Flash>
      </Color>
      <Color Index="5">
        <Name>灰色</Name>
        <ColorValueInHost>FF808080</ColorValueInHost>
        <Flash>false</Flash>
      </Color>
      <Color Index="6">
        <Name>红色</Name>
        <ColorValueInHost>FFFF0000</ColorValueInHost>
        <Flash>false</Flash>
      </Color>
      <Color Index="7">
        <Name>白色</Name>
        <ColorValueInHost>FFFFFFFF</ColorValueInHost>
        <Flash>false</Flash>
      </Color>
      <Color Index="8">
        <Name>浅蓝色</Name>
        <ColorValueInHost>FF99CCFF</ColorValueInHost>
        <Flash>false</Flash>
      </Color>
      <Color Index="9">
        <Name>洋红色</Name>
        <ColorValueInHost>FFFF00FF</ColorValueInHost>
        <Flash>false</Flash>
      </Color>
      <Color Index="10">
        <Name>浅紫色</Name>
        <ColorValueInHost>FFCC99FF</ColorValueInHost>
        <Flash>false</Flash>
      </Color>
      <Color Index="11">
        <Name>棕色</Name>
        <ColorValueInHost>FF802A2A</ColorValueInHost>
        <Flash>false</Flash>
      </Color>
      <Color Index="12">
        <Name>蓝色</Name>
        <ColorValueInHost>FF0000FF</ColorValueInHost>
        <Flash>false</Flash>
      </Color>
      <Color Index="13">
        <Name>黑色</Name>
        <ColorValueInHost>FF000000</ColorValueInHost>
        <Flash>false</Flash>
      </Color>
      <Color Index="14">
        <Name>黄色闪烁</Name>
        <ColorValueInHost>FFFFFF00</ColorValueInHost>
        <Flash>true</Flash>
      </Color>
      <Color Index="15">
        <Name>黄色</Name>
        <ColorValueInHost>FFFFFF00</ColorValueInHost>
        <Flash>false</Flash>
      </Color>
      <Color Index="16">
        <Name>绿色</Name>
        <ColorValueInHost>FF00FF00</ColorValueInHost>
        <Flash>false</Flash>
      </Color>
      <Color Index="17">
        <Name>透明色</Name>
        <ColorValueInHost>00000000</ColorValueInHost>
        <Flash>false</Flash>
      </Color>
      <Color Index="18">
        <Name>褐玫瑰红</Name>
        <ColorValueInHost>FFBC8F8F</ColorValueInHost>
        <Flash>false</Flash>
      </Color>
      <Color Index="19">
        <Name>浅黑</Name>
        <ColorValueInHost>FF010101</ColorValueInHost>
        <Flash>false</Flash>
      </Color>
      <Color Index="20">
        <Name>沙棕色</Name>
        <ColorValueInHost>FFF4A460</ColorValueInHost>
        <Flash>false</Flash>
      </Color>
      <Color Index="21">
        <Name>红色闪烁</Name>
        <ColorValueInHost>FFFF0000</ColorValueInHost>
        <Flash>true</Flash>
      </Color>
      <Color Index="22">
        <Name>浅蓝色闪烁</Name>
        <ColorValueInHost>FF99CCFF</ColorValueInHost>
        <Flash>true</Flash>
      </Color>
      <Color Index="23">
        <Name>灰色闪烁</Name>
        <ColorValueInHost>FF808080</ColorValueInHost>
        <Flash>true</Flash>
      </Color>
      <Color Index="24">
        <Name>洋红色闪烁</Name>
        <ColorValueInHost>FFFF00FF</ColorValueInHost>
        <Flash>true</Flash>
      </Color>
      <Color Index="25">
        <Name>棕色闪烁</Name>
        <ColorValueInHost>FF802A2A</ColorValueInHost>
        <Flash>true</Flash>
      </Color>
      <Color Index="26">
        <Name>蓝色闪烁</Name>
        <ColorValueInHost>FF0000FF</ColorValueInHost>
        <Flash>true</Flash>
      </Color>
      <Color Index="27">
        <Name>沙棕色闪烁</Name>
        <ColorValueInHost>FFF4A460</ColorValueInHost>
        <Flash>true</Flash>
      </Color>
      <Color Index="28">
        <Name>浅紫色闪烁</Name>
        <ColorValueInHost>FFCC99FF</ColorValueInHost>
        <Flash>true</Flash>
      </Color>
      <Color Index="29">
        <Name>白色闪烁</Name>
        <ColorValueInHost>FFFFFFFF</ColorValueInHost>
        <Flash>true</Flash>
      </Color>
      <Color Index="30">
        <Name>土棕色闪烁</Name>
        <ColorValueInHost>FF734A12</ColorValueInHost>
        <Flash>true</Flash>
      </Color>
      <Color Index="31">
        <Name>绿色闪烁</Name>
        <ColorValueInHost>FF00FF00</ColorValueInHost>
        <Flash>true</Flash>
      </Color>
      <Color Index="32">
        <Name>橘黄色</Name>
        <ColorValueInHost>FFFF8000</ColorValueInHost>
        <Flash>true</Flash>
      </Color>
      <DefaultColor>灰色</DefaultColor>
      <BackgroundColor>黑色</BackgroundColor>
      <FocusColor>褐玫瑰红</FocusColor>
      <FlashingInterval>1</FlashingInterval>
    </ColorLib>
  </GeneralInfo>
  <Blocks>
    <Block>
      <Name>TrackBlock</Name>
      <Icon Index="1">
        <Level>0</Level>
        <Type>0</Type>
        <ColorIndex>白色</ColorIndex>
        <DockLeft>true</DockLeft>
        <DockRight>true</DockRight>
        <DockTop>false</DockTop>
        <DockBottom>false</DockBottom>
        <Fixed>false</Fixed>
        <Rect>
          <Pos>
            <X>148</X>
            <Y>332</Y>
          </Pos>
          <Width>1079</Width>
          <Height>10</Height>
          <Weight>1</Weight>
          <Fill>true</Fill>
          <Angle>0</Angle>
        </Rect>
      </Icon>
    </Block>
    <Block>
      <Name>Track</Name>
      <Icon Index="1">
        <Level>0</Level>
        <Type>0</Type>
        <ColorIndex>灰色</ColorIndex>
        <DockLeft>false</DockLeft>
        <DockRight>false</DockRight>
        <DockTop>true</DockTop>
        <DockBottom>true</DockBottom>
        <Fixed>false</Fixed>
        <Rect>
          <Pos>
            <X>622</X>
            <Y>96</Y>
          </Pos>
          <Width>5</Width>
          <Height>282</Height>
          <Weight>1</Weight>
          <Fill>true</Fill>
          <Angle>0</Angle>
        </Rect>
      </Icon>
    </Block>
    <Block>
      <Name>DestCodeBound</Name>
      <Icon Index="1">
        <Level>0</Level>
        <Type>0</Type>
        <ColorIndex>白色</ColorIndex>
        <DockLeft>false</DockLeft>
        <DockRight>false</DockRight>
        <DockTop>true</DockTop>
        <DockBottom>true</DockBottom>
        <Fixed>false</Fixed>
        <LogicTable>
          <ComplexLogicTable>
            <LogicExpression>
              <Expression>!INPUT_LINK_STATUS</Expression>
              <ColorIndex>红色</ColorIndex>
            </LogicExpression>
            <LogicExpression>
              <Expression>INPUT_LINK_STATUS*!INPUT_WS_MASTERSLAVE</Expression>
              <ColorIndex>绿色</ColorIndex>
            </LogicExpression>
            <LogicExpression>
              <Expression>INPUT_LINK_STATUS*INPUT_WS_MASTERSLAVE</Expression>
              <ColorIndex>黄色</ColorIndex>
            </LogicExpression>
          </ComplexLogicTable>
        </LogicTable>
        <Rect>
          <Pos>
            <X>552</X>
            <Y>178</Y>
          </Pos>
          <Width>5</Width>
          <Height>282</Height>
          <Weight>1</Weight>
          <Fill>true</Fill>
          <Angle>0</Angle>
        </Rect>
      </Icon>
    </Block>
    <Block>
      <Name>GenerAlarm</Name>
      <Icon Index="1">
        <Level>0</Level>
        <Type>0</Type>
        <ColorIndex>白色</ColorIndex>
        <DockLeft>true</DockLeft>
        <DockRight>true</DockRight>
        <DockTop>true</DockTop>
        <DockBottom>true</DockBottom>
        <Fixed>false</Fixed>
        <Rect>
          <Pos>
            <X>306</X>
            <Y>119</Y>
          </Pos>
          <Width>603</Width>
          <Height>349</Height>
          <Weight>1</Weight>
          <Fill>false</Fill>
          <Angle>0</Angle>
        </Rect>
      </Icon>
    </Block>
    <Block>
      <Name>ServerAlarm</Name>
      <Icon Index="1">
        <Level>1</Level>
        <Type>0</Type>
        <ColorIndex>白色</ColorIndex>
        <DockLeft>false</DockLeft>
        <DockRight>false</DockRight>
        <DockTop>false</DockTop>
        <DockBottom>false</DockBottom>
        <Fixed>true</Fixed>
        <LogicTable>
          <ComplexLogicTable>
            <LogicExpression>
              <Expression>!INPUT_LINK_STATUS</Expression>
              <ColorIndex>红色</ColorIndex>
            </LogicExpression>
            <LogicExpression>
              <Expression>INPUT_LINK_STATUS*!INPUT_WS_MASTERSLAVE</Expression>
              <ColorIndex>绿色</ColorIndex>
            </LogicExpression>
            <LogicExpression>
              <Expression>INPUT_LINK_STATUS*INPUT_WS_MASTERSLAVE</Expression>
              <ColorIndex>黄色</ColorIndex>
            </LogicExpression>
          </ComplexLogicTable>
        </LogicTable>
        <Circle>
          <Pos>
            <X>269</X>
            <Y>240</Y>
          </Pos>
          <Diameter>10</Diameter>
          <Weight>1</Weight>
          <Fill>false</Fill>
        </Circle>
      </Icon>
      <Icon Index="1">
        <Level>1</Level>
        <Type>0</Type>
        <ColorIndex>白色</ColorIndex>
        <DockLeft>false</DockLeft>
        <DockRight>false</DockRight>
        <DockTop>false</DockTop>
        <DockBottom>false</DockBottom>
        <Fixed>true</Fixed>
        <LogicTable>
          <ComplexLogicTable>
            <LogicExpression>
              <Expression>!INPUT_LINK_STATUS</Expression>
              <ColorIndex>红色</ColorIndex>
            </LogicExpression>
            <LogicExpression>
              <Expression>INPUT_LINK_STATUS*!INPUT_WS_MASTERSLAVE</Expression>